{
  "schemaVersion": 1,
  "producer": {
    "parserVersion": "docling-2.132.0+norm-9+opts-da9fca75f112",
    "serviceVersion": "1.0.0",
    "doclingVersion": "2.132.0",
    "doclingCoreVersion": "2.99.0",
    "doclingIbmModelsVersion": "4.0.3",
    "normalizerVersion": "9",
    "pipelineOptionsSha256": "da9fca75f1125ec581ee98e9799578d12b3ec1b767c77c3f9544a2631d71fbb8"
  },
  "source": {
    "sha256": "3329a0cd7d9f62390daca9023ed867415b9c79c60d8f36f7c57bf29e5369efe4",
    "byteSize": 1016661
  },
  "pageCount": 1,
  "pages": [
    {
      "pageNumber": 1,
      "width": 930.0,
      "height": 1315.92,
      "text": "MIRAE ASSET NIFTY BANK ETF\nNSE Symbol: BANKETF , BSE Scrip Code: 543944\n(Exchange Traded Fund (ETF) - An open ended scheme replicating/tracking Nifty Bank Total Return Index)\nMonthly Factsheet as on 31 July, 2026\nFund Information\nFund Managers : Ms. Ekta Gala Mr. Ritesh Patel\nAllotment Date: 20th July 2023\nBenchmark: Nifty Bank Index (TRI)\nNet AUM (Cr.): 313.7953\nTracking Error Value ~ 1 Year Tracking Error is: 0.03%\nExit Load: Please refer page no.97\nPlan Available: The Scheme does not offer any Plans/Options for investment\nMinimum Investment Amount\nMarket Maker: Application for subscription of Units directly with the Fund in Creation Unit Size at NAV based prices in exchange of Portfolio Deposit and Cash Component.\nLarge Investors: Minimum amount of ₹25 crores for transacting directly with the AMC.\nOther investors (including Market Maker, Large\nInvestors and Regulated Entities): Units of the Scheme can be subscribed (in lots of 1 Unit) during\nthe trading hours on all trading days on the NSE and BSE on which the Units are listed.\nOn exchange In multiple of 1 units Directly with AMC In multiple of 10,000 units\nNet Asset Value (NAV)\n₹ 583.4601 (Per Unit)\nMarket Makers\nMirae Asset Capital Markets (India) Private Limited East India Securities Limited\nKanjalochana Finserve Private Limited\nParwati Capital Market Private Limited\nVaibhav Stock & Derivatives Broking Private Limited\nIRage Broking Services LLP\nJunomoneta Finsol Pvt Ltd\nMotilal Oswal Financial Services Limited\nObsidian Investment Pvt Ltd^^\nEureka Stock & Shares Broking Services Ltd^^^\nOthers\nLive iNav is updated on Mirae Asset Mutual Fund website.\nNSE Symbol: BANKETF\nBSE Code: 543944\nBloomberg Code: BANKETF IN Equity\nReuters Code: MIRA.NS\nBase Expense Ratio: 0.09%\nPortfolio Top 10 Holdings\nEquity Shares HDFC Bank Ltd.: 18.14%\nICICI Bank Ltd.: 14.81%\nState Bank of India: 10.05%\nKotak Mahindra Bank Ltd.: 9.29%\nAxis Bank Ltd.: 8.78%\nThe Federal Bank Ltd.: 7.26%\nIndusInd Bank Ltd.: 5.48%\nAU Small Finance Bank Ltd.: 4.70%\nIDFC First Bank Ltd.: 4.65%\nBank of Baroda: 3.57%\nOther Equities: 12.94%\nEquity Holding Total: 99.67%\nCash & Other Receivables: 0.33%\nTotal: 100.00%\nHow to Trade in ETF ?\nPerformance Report\nLast 1 Year, Mirae Asset Nifty Bank ETF = 2.91%. Last 1 Year, Scheme Benchmark* = 3.06%. Last 1 Year, Additional Benchmark** = -0.43%\nLast 3 Years, Mirae Asset Nifty Bank ETF = 8.57%. Last 3 Years, Scheme Benchmark* = 8.71%. Last 3 Years, Additional Benchmark** = 8.56%\nSince Inception, Mirae Asset Nifty Bank ETF = 8.01%. Since Inception, Scheme Benchmark* = 8.20%. Since Inception, Additional Benchmark** = 8.08%\nValue of Rs. 10000 invested Since Inception, Mirae Asset Nifty Bank ETF = ₹12,633. Value of Rs. 10000 invested Since Inception, Scheme Benchmark* = ₹12,700. Value of Rs. 10000 invested Since Inception, Additional Benchmark** = ₹12,658\nNAV as on 31st July, 2026, Mirae Asset Nifty Bank ETF = ₹583.4601\nIndex Value 31st July, 2026, Mirae Asset Nifty Bank ETF = Index Value of Scheme Benchmark is ₹80,254.8700 and Nifty 50 (TRI) is ₹37,000.7200\nAllotment Date, Mirae Asset Nifty Bank ETF = 20th July 2023\nScheme Benchmark, Mirae Asset Nifty Bank ETF = *Nifty Bank Index (TRI)\nAdditional Benchmark, Mirae Asset Nifty Bank ETF = **Nifty 50 (TRI)\nFund Managers : Ms. Ekta Gala (since July 20, 2023), Mr. Ritesh Patel (since March 12, 2025)\nNote: Returns (%) for less than 1 year calculated on simple annualized basis, others are CAGR- Compounded Annualized Growth returns.\nLatest available NAV has been taken for return calculation wherever applicable\nPast Performance may or may not be sustained in future.\nNote: For computation of since inception returns (%) the allotment NAV has been taken as ₹461.8690\nNote:1. The reference and details provided here in are of Regular Plan - Growth Option\n^^Pursuant to notice cum addendum no. 37/2026, a Market Maker has been added w.e.f May 04, 2026.\n^^^Pursuant to notice cum addendum no. 51/2026, a Market Maker has been added w.e.f June 19, 2026.\nThe performance of other funds managed by the same fund manager is given in the respective page of the schemes and on page No. 112, 113, 114, 115, 116, 117, 118, 119, 120, 121, 122, 123, 124, 125, 126, 127\nOverall Asset Allocation\nEquity Holdings: 99.67%\nCash & Other Receivables: 0.33%\nMIRAE ASSET NIFTY BANK ETF",
      "hasTable": true,
      "stats": {
        "textItems": 45,
        "tables": 3,
        "pictures": 13,
        "pictureTextChars": 50,
        "bodyTextChars": 4207
      }
    }
  ],
  "chunks": [
    {
      "chunkIndex": 0,
      "type": "text",
      "text": "(Exchange Traded Fund (ETF) - An open ended scheme replicating/tracking Nifty Bank Total Return Index)",
      "headings": [
        "MIRAE ASSET NIFTY BANK ETF",
        "NSE Symbol: BANKETF , BSE Scrip Code: 543944"
      ],
      "pages": [
        1
      ],
      "bboxes": [
        {
          "page": 1,
          "l": 60.0,
          "t": 1181.09,
          "r": 601.63,
          "b": 1169.37
        }
      ],
      "itemRefs": [
        "#/texts/2"
      ],
      "flags": [],
      "picture": null
    },
    {
      "chunkIndex": 1,
      "type": "text",
      "text": "Monthly Factsheet as on 31 July, 2026",
      "headings": [
        "MIRAE ASSET NIFTY BANK ETF",
        "NSE Symbol: BANKETF , BSE Scrip Code: 543944"
      ],
      "pages": [
        1
      ],
      "bboxes": [
        {
          "page": 1,
          "l": 60.0,
          "t": 1157.8,
          "r": 253.5,
          "b": 1147.06
        }
      ],
      "itemRefs": [
        "#/texts/3"
      ],
      "flags": [],
      "picture": null
    },
    {
      "chunkIndex": 2,
      "type": "key_value",
      "text": "Fund Managers : Ms. Ekta Gala Mr. Ritesh Patel\nAllotment Date: 20th July 2023\nBenchmark: Nifty Bank Index (TRI)\nNet AUM (Cr.): 313.7953\nTracking Error Value ~ 1 Year Tracking Error is: 0.03%\nExit Load: Please refer page no.97\nPlan Available: The Scheme does not offer any Plans/Options for investment",
      "headings": [
        "MIRAE ASSET NIFTY BANK ETF",
        "NSE Symbol: BANKETF , BSE Scrip Code: 543944",
        "Fund Information"
      ],
      "pages": [
        1
      ],
      "bboxes": [
        {
          "page": 1,
          "l": 60.41,
          "t": 1093.83,
          "r": 265.65,
          "b": 915.03
        }
      ],
      "itemRefs": [
        "#/tables/0"
      ],
      "flags": [
        "ordinal_joined",
        "kv_panel_detected"
      ],
      "picture": null
    },
    {
      "chunkIndex": 3,
      "type": "text",
      "text": "Market Maker: Application for subscription of Units directly with the Fund in Creation Unit Size at NAV based prices in exchange of Portfolio Deposit and Cash Component.\nLarge Investors: Minimum amount of ₹25 crores for transacting directly with the AMC.",
      "headings": [
        "MIRAE ASSET NIFTY BANK ETF",
        "NSE Symbol: BANKETF , BSE Scrip Code: 543944",
        "Fund Information",
        "Minimum Investment Amount"
      ],
      "pages": [
        1
      ],
      "bboxes": [
        {
          "page": 1,
          "l": 60.0,
          "t": 895.84,
          "r": 260.08,
          "b": 823.36
        }
      ],
      "itemRefs": [
        "#/texts/6",
        "#/texts/7"
      ],
      "flags": [],
      "picture": null
    },
    {
      "chunkIndex": 4,
      "type": "text",
      "text": "Investors and Regulated Entities): Units of the Scheme can be subscribed (in lots of 1 Unit) during\nthe trading hours on all trading days on the NSE and BSE on which the Units are listed.\nOn exchange In multiple of 1 units Directly with AMC In multiple of 10,000 units",
      "headings": [
        "MIRAE ASSET NIFTY BANK ETF",
        "NSE Symbol: BANKETF , BSE Scrip Code: 543944",
        "Fund Information",
        "Other investors (including Market Maker, Large"
      ],
      "pages": [
        1
      ],
      "bboxes": [
        {
          "page": 1,
          "l": 60.0,
          "t": 807.12,
          "r": 259.53,
          "b": 721.53
        }
      ],
      "itemRefs": [
        "#/texts/9",
        "#/texts/10",
        "#/texts/11"
      ],
      "flags": [
        "mixed_chunk_split"
      ],
      "picture": null
    },
    {
      "chunkIndex": 5,
      "type": "text",
      "text": "₹ 583.4601 (Per Unit)",
      "headings": [
        "MIRAE ASSET NIFTY BANK ETF",
        "NSE Symbol: BANKETF , BSE Scrip Code: 543944",
        "Net Asset Value (NAV)"
      ],
      "pages": [
        1
      ],
      "bboxes": [
        {
          "page": 1,
          "l": 60.0,
          "t": 677.41,
          "r": 141.55,
          "b": 668.99
        }
      ],
      "itemRefs": [
        "#/texts/13"
      ],
      "flags": [
        "mixed_chunk_split"
      ],
      "picture": null
    },
    {
      "chunkIndex": 6,
      "type": "text",
      "text": "Mirae Asset Capital Markets (India) Private Limited East India Securities Limited\nKanjalochana Finserve Private Limited\nParwati Capital Market Private Limited\nVaibhav Stock & Derivatives Broking Private Limited\nIRage Broking Services LLP\nJunomoneta Finsol Pvt Ltd\nMotilal Oswal Financial Services Limited\nObsidian Investment Pvt Ltd^^\nEureka Stock & Shares Broking Services Ltd^^^",
      "headings": [